{"candidate_artifact":{"path":"data/discovery/wave_69/stage_a/f1b5c956d7454a2a939ed8e3a780a7baca58b2b5cddd44313db6f79b2fc20256/proposals.jsonl","row_count":1024,"schema_version":"partizan.candidate_proposal.v0.1","sha256":"f1c633e26d5246385d9e6bff88255e79d548c086f85cee02775cb171a7d7e821"},"determinism":{"artifact_sha256":"f1c633e26d5246385d9e6bff88255e79d548c086f85cee02775cb171a7d7e821","byte_identical":true,"generation_receipt_ref":{"path":"data/discovery/wave_69/stage_a/f1b5c956d7454a2a939ed8e3a780a7baca58b2b5cddd44313db6f79b2fc20256/generation-receipt.json","receipt_id":"receipt-sha256:bc5c7fa381ecc6023b8ec8618ab9afae6aad329be31ef615373820fff6bbbbc6","schema_version":"partizan.candidate_generation_receipt.v0.1","sha256":"95c0e5236847cd1e833f400d27e960b7a84778c0cbdba95c642121ca8522e2e3"},"operation":"separate_process_generation","raw_artifact_sha256":["f1c633e26d5246385d9e6bff88255e79d548c086f85cee02775cb171a7d7e821","f1c633e26d5246385d9e6bff88255e79d548c086f85cee02775cb171a7d7e821"],"run_count":2},"generator":{"config_sha256":"e30e39dbbc03b4d951b60eaf7488e597814466aa389e3abe8e83458b494b1714","name":"partizan_candidate_pool_generator","random_seed":15824076400387734239,"version":"0.1.0"},"pool_id":"pool-sha256:f43f45ce2e18550671cdaeffc79442f90f7c4c48832ff019ded951f4729e5674","ranker_boundary":{"allowed_proposal_paths":["/position","/proposal_features"],"allowed_target_paths":["/ranker_view"],"audit_passed":true,"contract_id":"proposal_only_ranker_input_v0.1","generation_phase":"offline_before_any_verifier_call"},"schema_version":"partizan.candidate_pool_manifest.v0.2","source_repositories":{"astralbase":"1434fca1fc04d97798ec1b820c56f52f8014ccc7","bitmesh":"ade3417a007b9c8392d8a153abc4b3ed23edf0aa","partizan":"604ab9ef1e7bfc4bcc8dd8fb0c19ebdc59cf0e5a","thermograph":"1d9b6b01c3921aca8c2a8fb13972fee8a4de5041"},"target_ref":{"sha256":"00b3458021b6d3243d9b7840e87cf63990be1cece26f023c69e25d284b10fc58","target_id":"target-sha256:f1b5c956d7454a2a939ed8e3a780a7baca58b2b5cddd44313db6f79b2fc20256"}}
