{"candidate_artifact":{"path":"data/discovery/wave_69/stage_a/8ceee173bf9c9f8e498a058ba15e2d6e4d37ec3ce0b2b7caf8607ac63744ab5b/proposals.jsonl","row_count":1024,"schema_version":"partizan.candidate_proposal.v0.1","sha256":"26d51146affa2b21f8a25708353eda2bba4ca80dbd859125c6efca1264585fcf"},"determinism":{"artifact_sha256":"26d51146affa2b21f8a25708353eda2bba4ca80dbd859125c6efca1264585fcf","byte_identical":true,"generation_receipt_ref":{"path":"data/discovery/wave_69/stage_a/8ceee173bf9c9f8e498a058ba15e2d6e4d37ec3ce0b2b7caf8607ac63744ab5b/generation-receipt.json","receipt_id":"receipt-sha256:89d07fca4111ee5ba8e8472a84c1f755fd95b3796537b63526516d988c8cd5bf","schema_version":"partizan.candidate_generation_receipt.v0.1","sha256":"7a73391ebc2f3ee81c60e51404b00cb9f0b101dc71ceeab511294a236e80c1e9"},"operation":"separate_process_generation","raw_artifact_sha256":["26d51146affa2b21f8a25708353eda2bba4ca80dbd859125c6efca1264585fcf","26d51146affa2b21f8a25708353eda2bba4ca80dbd859125c6efca1264585fcf"],"run_count":2},"generator":{"config_sha256":"c6b12d525f6954ad2ffd14f305c4ae338a8a2f0f0dba75a30d8e4ded4771771d","name":"partizan_candidate_pool_generator","random_seed":18084658403807373493,"version":"0.1.0"},"pool_id":"pool-sha256:56a5b80f3efcb435d895bb2ea34bd120f4dbefc803bf9351c200dad7aeb41c32","ranker_boundary":{"allowed_proposal_paths":["/position","/proposal_features"],"allowed_target_paths":["/ranker_view"],"audit_passed":true,"contract_id":"proposal_only_ranker_input_v0.1","generation_phase":"offline_before_any_verifier_call"},"schema_version":"partizan.candidate_pool_manifest.v0.2","source_repositories":{"astralbase":"1434fca1fc04d97798ec1b820c56f52f8014ccc7","bitmesh":"ade3417a007b9c8392d8a153abc4b3ed23edf0aa","partizan":"604ab9ef1e7bfc4bcc8dd8fb0c19ebdc59cf0e5a","thermograph":"1d9b6b01c3921aca8c2a8fb13972fee8a4de5041"},"target_ref":{"sha256":"d9bfaae4242c9c27d89704e8704632107fdb2c897d6d1e22a7338bdc0f41fcca","target_id":"target-sha256:8ceee173bf9c9f8e498a058ba15e2d6e4d37ec3ce0b2b7caf8607ac63744ab5b"}}
