{"candidate_artifact":{"path":"data/discovery/wave_69/stage_a/41bb336e2bee89d4bdf6b5b7a9d9e1c3c8e1fd27da111dbaecac18ae9e553d6a/proposals.jsonl","row_count":1024,"schema_version":"partizan.candidate_proposal.v0.1","sha256":"3958136c7b78b4a6abc774a58133e6ca841d14cdcfe75d6f9af999a227d5ba68"},"determinism":{"artifact_sha256":"3958136c7b78b4a6abc774a58133e6ca841d14cdcfe75d6f9af999a227d5ba68","byte_identical":true,"generation_receipt_ref":{"path":"data/discovery/wave_69/stage_a/41bb336e2bee89d4bdf6b5b7a9d9e1c3c8e1fd27da111dbaecac18ae9e553d6a/generation-receipt.json","receipt_id":"receipt-sha256:6e70f565e9b58f04e083fd647754975be272b680190bfb502d2edff135ed6cb4","schema_version":"partizan.candidate_generation_receipt.v0.1","sha256":"16036562d2358e60f892b7c8e6c17ff1217b589acbf54b914bf648fff861d723"},"operation":"separate_process_generation","raw_artifact_sha256":["3958136c7b78b4a6abc774a58133e6ca841d14cdcfe75d6f9af999a227d5ba68","3958136c7b78b4a6abc774a58133e6ca841d14cdcfe75d6f9af999a227d5ba68"],"run_count":2},"generator":{"config_sha256":"b3538921105ac70919954ecd8339854aeed2e84ddf92dd48dce786206c7d3071","name":"partizan_candidate_pool_generator","random_seed":3801062396562257051,"version":"0.1.0"},"pool_id":"pool-sha256:027ba75d52c981c3a5906e9d2ab693a0034b4de0cf8973e8b07a46d9e4c5e2d6","ranker_boundary":{"allowed_proposal_paths":["/position","/proposal_features"],"allowed_target_paths":["/ranker_view"],"audit_passed":true,"contract_id":"proposal_only_ranker_input_v0.1","generation_phase":"offline_before_any_verifier_call"},"schema_version":"partizan.candidate_pool_manifest.v0.2","source_repositories":{"astralbase":"1434fca1fc04d97798ec1b820c56f52f8014ccc7","bitmesh":"ade3417a007b9c8392d8a153abc4b3ed23edf0aa","partizan":"604ab9ef1e7bfc4bcc8dd8fb0c19ebdc59cf0e5a","thermograph":"1d9b6b01c3921aca8c2a8fb13972fee8a4de5041"},"target_ref":{"sha256":"3dbce1bf72526ab8cb8849d0c437be2e17122896512573f9989153251c15c896","target_id":"target-sha256:41bb336e2bee89d4bdf6b5b7a9d9e1c3c8e1fd27da111dbaecac18ae9e553d6a"}}
