{"candidate_artifact":{"path":"data/discovery/wave_69/stage_a/07de65c35e848be61c6f96872b1b20f3a101efa9b461750c502060842599e0c6/proposals.jsonl","row_count":1024,"schema_version":"partizan.candidate_proposal.v0.1","sha256":"46b4c994bcdbb966b70d091a65a5fff4d8137be0ae37c026ae6bfb0faf92cf28"},"determinism":{"artifact_sha256":"46b4c994bcdbb966b70d091a65a5fff4d8137be0ae37c026ae6bfb0faf92cf28","byte_identical":true,"generation_receipt_ref":{"path":"data/discovery/wave_69/stage_a/07de65c35e848be61c6f96872b1b20f3a101efa9b461750c502060842599e0c6/generation-receipt.json","receipt_id":"receipt-sha256:0ea8476daa26396ff44d2a104322f17e4b9b492fe8af7e4b1603cb2d2f4e1144","schema_version":"partizan.candidate_generation_receipt.v0.1","sha256":"ea5a4bb6b7f4c8e6efaaf26917512a51fb20bdfab359629ff0399f3779fa86cd"},"operation":"separate_process_generation","raw_artifact_sha256":["46b4c994bcdbb966b70d091a65a5fff4d8137be0ae37c026ae6bfb0faf92cf28","46b4c994bcdbb966b70d091a65a5fff4d8137be0ae37c026ae6bfb0faf92cf28"],"run_count":2},"generator":{"config_sha256":"ec15748f3172dd063d819bf325a129aec40744096c0899e4d899bdc5a5f5eee0","name":"partizan_candidate_pool_generator","random_seed":10750487050513559786,"version":"0.1.0"},"pool_id":"pool-sha256:f951093789b541975c6f1cc3fcfbe71318dd3f62a83f7f992c0c10968b8e108f","ranker_boundary":{"allowed_proposal_paths":["/position","/proposal_features"],"allowed_target_paths":["/ranker_view"],"audit_passed":true,"contract_id":"proposal_only_ranker_input_v0.1","generation_phase":"offline_before_any_verifier_call"},"schema_version":"partizan.candidate_pool_manifest.v0.2","source_repositories":{"astralbase":"1434fca1fc04d97798ec1b820c56f52f8014ccc7","bitmesh":"ade3417a007b9c8392d8a153abc4b3ed23edf0aa","partizan":"604ab9ef1e7bfc4bcc8dd8fb0c19ebdc59cf0e5a","thermograph":"1d9b6b01c3921aca8c2a8fb13972fee8a4de5041"},"target_ref":{"sha256":"a307dc1239e7c59428444bbfb2f7ff5942121bc37ea623213fd37a56c80b92bc","target_id":"target-sha256:07de65c35e848be61c6f96872b1b20f3a101efa9b461750c502060842599e0c6"}}
