{"candidate_artifact":{"path":"data/discovery/wave_69/stage_a/052f4191fdcbb6fa45716b97cc85949f8c2287c75d532893084955ab7c666122/proposals.jsonl","row_count":1024,"schema_version":"partizan.candidate_proposal.v0.1","sha256":"d2a5007461ae2f69193cd3147f4c834bb35228841c20e9fff37e73e353d557b9"},"determinism":{"artifact_sha256":"d2a5007461ae2f69193cd3147f4c834bb35228841c20e9fff37e73e353d557b9","byte_identical":true,"generation_receipt_ref":{"path":"data/discovery/wave_69/stage_a/052f4191fdcbb6fa45716b97cc85949f8c2287c75d532893084955ab7c666122/generation-receipt.json","receipt_id":"receipt-sha256:9367450e2061daee9cba8e1ee2fc47bd7b0c76f84484969ae00a189c4b835610","schema_version":"partizan.candidate_generation_receipt.v0.1","sha256":"4989281fc1a5ba4f5d5ad83334f2de52b8090422640e8aea7c9d13dfefd16aaa"},"operation":"separate_process_generation","raw_artifact_sha256":["d2a5007461ae2f69193cd3147f4c834bb35228841c20e9fff37e73e353d557b9","d2a5007461ae2f69193cd3147f4c834bb35228841c20e9fff37e73e353d557b9"],"run_count":2},"generator":{"config_sha256":"1d5ce1a35c4729e1caa9d40b25b72ec2dd2e5781e33d4cd76ce38b089cdb03a1","name":"partizan_candidate_pool_generator","random_seed":17672373659205594994,"version":"0.1.0"},"pool_id":"pool-sha256:a75370e363bb127495411f57531d9a5a1fc0bd7997888218a70c2f87623ec273","ranker_boundary":{"allowed_proposal_paths":["/position","/proposal_features"],"allowed_target_paths":["/ranker_view"],"audit_passed":true,"contract_id":"proposal_only_ranker_input_v0.1","generation_phase":"offline_before_any_verifier_call"},"schema_version":"partizan.candidate_pool_manifest.v0.2","source_repositories":{"astralbase":"1434fca1fc04d97798ec1b820c56f52f8014ccc7","bitmesh":"ade3417a007b9c8392d8a153abc4b3ed23edf0aa","partizan":"604ab9ef1e7bfc4bcc8dd8fb0c19ebdc59cf0e5a","thermograph":"1d9b6b01c3921aca8c2a8fb13972fee8a4de5041"},"target_ref":{"sha256":"57921821c322d3d82c3c44eb385ef25b72b333655f83e7864f290c69cb606041","target_id":"target-sha256:052f4191fdcbb6fa45716b97cc85949f8c2287c75d532893084955ab7c666122"}}
