{"candidate_artifact":{"path":"data/discovery/wave_69/stage_a/73492503d817eb3406951fa9fbe127e8f362401b7d9d695163d7e0c4b1ecdc00/proposals.jsonl","row_count":1024,"schema_version":"partizan.candidate_proposal.v0.1","sha256":"180646a31053c01f060bef58fdbb4a0f2e0e28e2a58c63cade27b744a4bc3a01"},"determinism":{"artifact_sha256":"180646a31053c01f060bef58fdbb4a0f2e0e28e2a58c63cade27b744a4bc3a01","byte_identical":true,"generation_receipt_ref":{"path":"data/discovery/wave_69/stage_a/73492503d817eb3406951fa9fbe127e8f362401b7d9d695163d7e0c4b1ecdc00/generation-receipt.json","receipt_id":"receipt-sha256:2f4f1b2109fe6f7eb1099918ebcacdd5252dc9f73cff721a9357b01b8c0ccf38","schema_version":"partizan.candidate_generation_receipt.v0.1","sha256":"460cf402eca925073b2bf8cb5b6d456a4edcb46dfd65345492ad4c4a6815380a"},"operation":"separate_process_generation","raw_artifact_sha256":["180646a31053c01f060bef58fdbb4a0f2e0e28e2a58c63cade27b744a4bc3a01","180646a31053c01f060bef58fdbb4a0f2e0e28e2a58c63cade27b744a4bc3a01"],"run_count":2},"generator":{"config_sha256":"46fe98f2bdff1bf01e5243b9aeb64aefd5baa542e0248b1d37ee13d91556a80b","name":"partizan_candidate_pool_generator","random_seed":6801261912781277260,"version":"0.1.0"},"pool_id":"pool-sha256:6a85c7a3fe82d5710f2d81e3e26f9fd14cab5ee7a5c07f9dfae07bdc50805fc6","ranker_boundary":{"allowed_proposal_paths":["/position","/proposal_features"],"allowed_target_paths":["/ranker_view"],"audit_passed":true,"contract_id":"proposal_only_ranker_input_v0.1","generation_phase":"offline_before_any_verifier_call"},"schema_version":"partizan.candidate_pool_manifest.v0.2","source_repositories":{"astralbase":"1434fca1fc04d97798ec1b820c56f52f8014ccc7","bitmesh":"ade3417a007b9c8392d8a153abc4b3ed23edf0aa","partizan":"604ab9ef1e7bfc4bcc8dd8fb0c19ebdc59cf0e5a","thermograph":"1d9b6b01c3921aca8c2a8fb13972fee8a4de5041"},"target_ref":{"sha256":"89aa4fd525615007189340b2e0da6703b52240e9b6490bd6f5238d0285cb9a63","target_id":"target-sha256:73492503d817eb3406951fa9fbe127e8f362401b7d9d695163d7e0c4b1ecdc00"}}
